{
  "schema_version": 1,
  "run_id": "run_01JBQ2Z8Y3K4M5N6P7Q8R9S0T1",
  "incident_id": "inc_01JBQ2Z8Y3K4M5N6P7Q8R9S0T1",
  "agent": "metrics",
  "status": "completed",
  "findings": [
    {
      "claim": "checkout p95 latency increased",
      "severity": "high",
      "evidence_ids": ["ev_01JBQ2Z8Y3K4M5N6P7Q8R9S0T1"],
      "time_window": { "start_at": "2026-10-22T05:45:00Z", "end_at": "2026-10-22T06:00:00Z" }
    }
  ],
  "hypotheses": [
    {
      "description": "Database dependency is slow",
      "category": "dependency_failure",
      "entities": ["checkout", "postgres"],
      "evidence_ids": ["ev_01JBQ2Z8Y3K4M5N6P7Q8R9S0T1"],
      "counterevidence_ids": []
    }
  ],
  "missing_data": ["database tracing"],
  "budget_used": { "llm_calls": 3, "tokens_in": 5200, "tokens_out": 800, "tool_calls": 6, "cost_usd": 0.012, "duration_ms": 8400 },
  "stop_reason": "done"
}
